Version,ID,Book,Chapter,Chapter Title,Content
English Standard Version,ESV,1 John,3,Love One Another,"See what kind of love the Father has given to us, that we should be called (B)children of God; and so we are. The reason why (C)the world does not know us is that (D)it did not know him. 2 Beloved, we are God's children (F)now, and what we will be (G)has not yet appeared; but we know that (H)when he appears[a] (I)we shall be like him, because (J)we shall see him as he is. 3 And everyone who thus hopes in him (L)purifies himself as he is pure. 4 Everyone who makes a practice of sinning also practices lawlessness; sin is lawlessness. 5 You know that he appeared in order to (O)take away sins, and (P)in him there is no sin. 6 No one who abides in him keeps on sinning; no one who keeps on sinning has either seen him or known him. 7 Little children, let no one deceive you. (S)Whoever practices righteousness is righteous, as he is righteous. 8 Whoever makes a practice of sinning is of the devil, for the devil has been sinning from the beginning. The reason the Son of God appeared was (U)to destroy the works of the devil. 9 No one born of God makes a practice of sinning, for God's[b] seed abides in him; and he cannot keep on sinning, because he has been born of God. 10 By this it is evident who are the children of God, and who are the children of the devil: whoever does not practice righteousness is not of God, nor is the one who (X)does not love his brother. 11 For this is the message that you have heard from the beginning, (Z)that we should love one another. 12 We should not be like Cain, who was of the evil one and murdered his brother. And why did he murder him? (AB)Because his own deeds were evil and his brother's righteous. 13 Do not be surprised, brothers,[c] that the world hates you. 14 We know that we have passed out of death into life, because we love the brothers. Whoever does not love abides in death. 15 Everyone who hates his brother is a murderer, and you know that (AF)no murderer has eternal life abiding in him. 16 By this we know love, that he laid down his life for us, and (AH)we ought to lay down our lives for the brothers. 17 But if anyone has the world's goods and sees his brother in need, yet (AJ)closes his heart against him, (AK)how does God's love abide in him? 18 Little children, let us not love in word or talk but in deed and (AM)in truth. 19 By this we shall know that we are of the truth and reassure our heart before him; 20 for whenever our heart condemns us, God is greater than our heart, and he knows everything. 21 Beloved, if our heart does not condemn us, (AO)we have confidence before God; 22 and whatever we ask we receive from him, because we keep his commandments and (AQ)do what pleases him. 23 And this is his commandment, that we believe in the name of his Son Jesus Christ and (AS)love one another, (AT)just as he has commanded us. 24 Whoever keeps his commandments abides in God,[d] and God[e] in him. And (AV)by this we know that he abides in us, by the Spirit whom he has given us. "
English Standard Version Anglicised,ESVUK,1 John,4,Test the Spirits,"Beloved, do not believe every spirit, but (B)test the spirits to see whether they are from God, for (C)many (D)false prophets (E)have gone out into the world. 2 By this you know the Spirit of God: every spirit that confesses that (G)Jesus Christ has come in the flesh is from God, 3 and every spirit that does not confess Jesus is not from God. This is the spirit of the antichrist, which you heard was coming and (I)now is in the world already. 4 Little children, you are from God and have overcome them, for he who is in you is greater than (K)he who is in the world. 5 They are from the world; therefore they speak from the world, and (M)the world listens to them. 6 We are from God. Whoever knows God listens to us; whoever is not from God does not listen to us. By this we know (O)the Spirit of truth and (P)the spirit of error. 7 Beloved, let us love one another, for love is from God, and (R)whoever loves has been born of God and knows God. 8 Anyone who does not love does not know God, because (T)God is love. 9 In this the love of God was made manifest among us, that God sent his only Son into the world, so that we might live through him. 10 In this is love, not that we have loved God (W)but that he loved us and sent his Son to be (X)the propitiation for our sins. 11 Beloved, if God so loved us, we also ought to love one another. 12 No one has ever seen God; if we love one another, God abides in us and (Z)his love is perfected in us. 13 By this we know that we abide in him and he in us, because he has given us of his Spirit. 14 And we have seen and testify that (AC)the Father has sent his Son to be the Saviour of (AD)the world. 15 Whoever confesses that Jesus is the Son of God, God abides in him, and he in God. 16 So we have come to know and to believe the love that God has for us. (AG)God is love, and (AH)whoever abides in love abides in God, and God abides in him. 17 By this is love perfected with us, so that (AJ)we may have confidence for the day of judgement, because (AK)as he is so also are we in this world. 18 There is no fear in love, but perfect love casts out fear. For fear has to do with punishment, and whoever fears has not (AM)been perfected in love. 19 We love because he first loved us. 20 If anyone says, I love God, and (AP)hates his brother, he is a liar; for he who does not love his brother whom he has seen cannot[a] love God (AQ)whom he has not seen. 21 And this commandment we have from him: (AS)whoever loves God must also love his brother. "
English Standard Version Anglicised,ESVUK,1 John,2,Christ Our Advocate,"My little children, I am writing these things to you so that you may not sin. But if anyone does sin, we have an advocate with the Father, Jesus Christ the righteous. 2 He is the propitiation for our sins, and not for ours only but (C)also for the sins of the whole world. 3 And by this we know that we have come to know him, if we keep his commandments. 4 Whoever says I know him but does not keep his commandments is a liar, and (F)the truth is not in him, 5 but whoever keeps his word, in him truly (H)the love of God is perfected. (I)By this we may know that we are in him: 6 whoever says he abides in him (K)ought to walk in the same way in which he walked. 7 Beloved, I am writing you no new commandment, but (M)an old commandment (N)that you had from the beginning. The old commandment is the word that you have heard. 8 At the same time, it is a new commandment that I am writing to you, which is true in him and in you, because[a] (P)the darkness is passing away and (Q)the true light is already shining. 9 Whoever says he is in the light and hates his brother is still in darkness. 10 Whoever loves his brother abides in the light, and in him[b] there is no cause for stumbling. 11 But whoever hates his brother is in the darkness and walks in the darkness, and does not know where he is going, because the darkness has blinded his eyes. 12 I am writing to you, little children, because your sins are forgiven for his name's sake. 13 I am writing to you, fathers, because you know him who is from the beginning. I am writing to you, young men, because you have overcome the evil one. I write to you, children, because you know the Father. 14 I write to you, fathers, because you know him who is from the beginning. I write to you, young men, because you are strong, and the word of God abides in you, and you have overcome the evil one. 15 Do not love the world or the things in the world. (AB)If anyone loves the world, the love of the Father is not in him. 16 For all that is in the worldthe desires of the flesh and (AD)the desires of the eyes and pride in possessionsis not from the Father but is from the world. 17 And the world is passing away along with its desires, but whoever does the will of God abides for ever. 18 Children, it is the last hour, and as you have heard that (AG)antichrist is coming, so now (AH)many antichrists have come. (AI)Therefore we know that it is the last hour. 19 They went out from us, but they were not of us; for (AK)if they had been of us, they would have continued with us. But they went out, (AL)that it might become plain that they all are not of us. 20 But you have been anointed by (AN)the Holy One, and (AO)you all have knowledge.[c] 21 I write to you, not because you do not know the truth, but because you know it, and because no lie is of the truth. 22 Who is the liar but he who denies that Jesus is the Christ? This is (AQ)the antichrist, he who denies the Father and the Son. 23 No one who denies the Son has the Father. Whoever confesses the Son has the Father also. 24 Let what you heard from the beginning abide in you. If what you heard from the beginning abides in you, then (AT)you too will abide in the Son and in the Father. 25 And this is the promise that he made to us[d]eternal life. 26 I write these things to you about those who are trying to deceive you. 27 But the anointing that you received from him abides in you, and (AX)you have no need that anyone should teach you. But as his anointing teaches you about everything, and (AY)is true, and is no liejust as it has taught you, abide in him. 28 And now, little children, abide in him, so that when he appears (BA)we may have confidence and not shrink from him in shame at his (BB)coming. 29 If you know that he is righteous, you may be sure that (BD)everyone who practises righteousness has been born of him. "
English Standard Version,ESV,1 John,4,Test the Spirits,"Beloved, do not believe every spirit, but (B)test the spirits to see whether they are from God, for (C)many (D)false prophets (E)have gone out into the world. 2 By this you know the Spirit of God: every spirit that confesses that (G)Jesus Christ has come in the flesh is from God, 3 and every spirit that does not confess Jesus is not from God. This is the spirit of the antichrist, which you heard was coming and (I)now is in the world already. 4 Little children, you are from God and have overcome them, for he who is in you is greater than (K)he who is in the world. 5 They are from the world; therefore they speak from the world, and (M)the world listens to them. 6 We are from God. Whoever knows God listens to us; whoever is not from God does not listen to us. By this we know (O)the Spirit of truth and (P)the spirit of error. 7 Beloved, let us love one another, for love is from God, and (R)whoever loves has been born of God and knows God. 8 Anyone who does not love does not know God, because (T)God is love. 9 In this the love of God was made manifest among us, that God sent his only Son into the world, so that we might live through him. 10 In this is love, not that we have loved God (W)but that he loved us and sent his Son to be (X)the propitiation for our sins. 11 Beloved, if God so loved us, we also ought to love one another. 12 No one has ever seen God; if we love one another, God abides in us and (Z)his love is perfected in us. 13 By this we know that we abide in him and he in us, because he has given us of his Spirit. 14 And we have seen and testify that (AC)the Father has sent his Son to be the Savior of (AD)the world. 15 Whoever confesses that Jesus is the Son of God, God abides in him, and he in God. 16 So we have come to know and to believe the love that God has for us. (AG)God is love, and (AH)whoever abides in love abides in God, and God abides in him. 17 By this is love perfected with us, so that (AJ)we may have confidence for the day of judgment, because (AK)as he is so also are we in this world. 18 There is no fear in love, but perfect love casts out fear. For fear has to do with punishment, and whoever fears has not (AM)been perfected in love. 19 We love because he first loved us. 20 If anyone says, I love God, and (AP)hates his brother, he is a liar; for he who does not love his brother whom he has seen cannot[a] love God (AQ)whom he has not seen. 21 And this commandment we have from him: (AS)whoever loves God must also love his brother. "
Evangelical Heritage Version,EHV,1 John,5,"Faith, Love, and Obedience","Everyone who believes that Jesus is the Christ has been born of God, and everyone who loves the God who has given birth[a] also loves one who has been born of him. 2 This is how we know that we love the children of God: when we love God and keep his commands. 3 In fact, this is love for God: that we keep his commands. And his commands are not burdensome, 4 because everyone who has been born of God overcomes the world. This is the victory that has overcome the world: our faith. 5 Who is the one who overcomes the world? Only the one who believes that Jesus is the Son of God. 6 This is the one who came by water and blood: Jesus Christ. He did not come by the water alone but by the water and by the blood. The Spirit is the one who testifies, because the Spirit is the truth. 7 In fact, there are three that testify:[b] 8 the Spirit, the water, and the blood, and these three are one. 9 If we accept the testimony of people, Gods testimony is even greater, because it is the testimony that God gave about his Son. 10 The one who believes in the Son of God has this testimony in him, but the one who does not believe has made God out to be a liar, because he has not believed in the testimony that God gave about his Son. 11 This is the testimony: God has given us eternal life, and this life is in his Son. 12 The one who has the Son has life. The one who does not have the Son of God does not have life. 13 I have written these things to you who believe in the name of the Son of God so that you may know that you have eternal life. 14 This is the confidence that we have before him: that if we ask anything according to his will, he hears us. 15 And if we know that he hears uswhatever we askwe also know that we receive the things we have asked from him. 16 If anyone sees his brother committing a sin that does not result in death, he will ask, and God will give lifeto those who commit sin that does not result in death. There is sin that results in death; I am not saying that he should ask about that. 17 All unrighteousness is sin, but there is sin that does not result in death. 18 We know that anyone who has been born of God does not go on sinning. But the one who was born of God protects him,[c] and the Evil One cannot take hold of him. 19 We know that we are from God and that the whole world lies in the grip of the Evil One. 20 We know that the Son of God has come and has given us understanding so that we may know him who is true. And we are in him who is true, in his Son, Jesus Christ. He is the true God and eternal life. 21 Dear children, guard yourselves from idols. "
English Standard Version,ESV,1 John,5,Overcoming the World,"Everyone who believes that (B)Jesus is the Christ has been born of God, and (C)everyone who loves the Father loves whoever has been born of him. 2 By this we know that we love the children of God, when we love God and obey his commandments. 3 For this is the love of God, that we (F)keep his commandments. And (G)his commandments are not burdensome. 4 For everyone who has been born of God overcomes the world. And this is the victory that has overcome the world(I)our faith. 5 Who is it that overcomes the world except the one who believes that Jesus is the Son of God? 6 This is he who came by water and bloodJesus Christ; not by the water only but by the water and the blood. And (L)the Spirit is the one who testifies, because (M)the Spirit is the truth. 7 For there are three that testify: 8 the Spirit and the water and the blood; and these three agree. 9 If we receive the testimony of men, the testimony of God is greater, for this is the testimony of God (O)that he has borne concerning his Son. 10 Whoever believes in the Son of God has the testimony in himself. Whoever does not believe God (Q)has made him a liar, (R)because he has not believed in the testimony that God has borne concerning his Son. 11 And this is the testimony, that God gave us eternal life, and (T)this life is in his Son. 12 Whoever has the Son has life; whoever does not have the Son of God does not have life. 13 I write these things to you who (W)believe in the name of the Son of God, that you may know that you have eternal life. 14 And this is the confidence that we have toward him, that (Y)if we ask anything according to his will he hears us. 15 And if we know that he hears us in whatever we ask, we know that we have the requests that we have asked of him. 16 If anyone sees his brother committing a sin not leading to death, he shall ask, and God[a] will give him lifeto those who commit sins that do not lead to death. (AA)There is sin that leads to death; (AB)I do not say that one should pray for that. 17 All wrongdoing is sin, but there is sin that does not lead to death. 18 We know that everyone who has been born of God does not keep on sinning, but (AE)he who was born of God (AF)protects him, and the evil one does not touch him. 19 We know that we are from God, and the whole world lies in the power of the evil one. 20 And we know that the Son of God has come and has given us understanding, so that we may know (AI)him who is true; and we are in him who is true, in his Son Jesus Christ. He is the true God and (AJ)eternal life. 21 Little children, keep yourselves from idols. "
Evangelical Heritage Version,EHV,1 John,4,Test the Spirits,"Dear friends, do not believe every spirit, but test the spirits to see if they are from God, for many false prophets have gone out into the world. 2 This is how you can recognize the Spirit of God: Every spirit who confesses that Jesus Christ has come in the flesh is from God, 3 and every spirit who does not confess Jesus[a] is not from God. This is the spirit of the Antichrist, which you have heard is coming and is already in the world. 4 You are from God, dear children, and you have overcome the false prophets,[b] because the one in you is greater than the one in the world. 5 They are from the world. That is why they speak from a worldly perspective and the world listens to them. 6 We are from God. The one who knows God listens to us, but whoever is not from God does not listen to us. That is how we can distinguish between the spirit of truth and the spirit of error. 7 Dear friends, let us love one another, because love comes from God. Everyone who loves has been born of God and knows God. 8 The one who does not love has not known God, because God is love. 9 This is how Gods love for us was revealed: God has sent his only-begotten Son into the world so that we may live through him. 10 This is love: not that we have loved God, but that he loved us and sent his Son to be the atoning sacrifice for our sins. 11 Dear friends, if God loved us so much, we also should love one another. 12 No one has ever seen God. If we love one another, God remains in us and his love has been brought to its goal in us. 13 This is how we know that we remain in him and he in us: He has given us of his Spirit. 14 We have seen and testify that the Father has sent his Son to be the Savior of the world. 15 If anyone confesses that Jesus is the Son of God, God remains in him and he in God. 16 We also have come to know and trust the love that God has for us. God is love. Whoever remains in love remains in God and God in him. 17 In this way his love has been brought to its goal among us, so that we may have confidence on the day of judgment, because in this world we are just like Jesus.[c] 18 There is no fear in love, but complete love drives out fear, because fear has to do with punishment. The one who continues to be afraid has not been brought to the goal in love. 19 We love[d] because he first loved us. 20 If anyone says, I love God, but hates his brother, he is a liar. For how can anyone who does not love his brother, whom he has seen,[e] love God, whom he has not seen? 21 This then is the command we have from him: The one who loves God should also love his brother. "
Expanded Bible,EXB,1 John,5,Faith in the Son of God,"Everyone who believes that Jesus is the Christ [Messiah] is Gods child [Lborn of/begotten by God], and whoever loves the Father also loves the Fathers children [Lone born of/begotten by him]. 2 This is how [By/In this] we know we love Gods children: when we love God and obey [perform; carry out] his commands. 3 Loving God means [LFor this is the love of God:] obeying [keeping] his commands. And Gods commands are not too hard [burdensome] for us [Matt. 11:30], 4 because everyone who is a child of [Lborn of; begotten of] God conquers [defeats; overcomes] the world. And this is the victory [conquest] that conquers [defeats; overcomes] the worldour faith. 5 So the one who conquers the world is [or Who is it that conquers/defeats/overcomes the world but?] the person who believes that Jesus is the Son of God. 6 Jesus Christ is the One who came by water [Clikely a reference to Jesus baptism] and blood [Ca reference to his death]. He did not come by water only, but by water and blood. And the Spirit says that this is true [is the one who testifies/bears witness; Mark 1:11; John 1:3234], because the Spirit is the truth. 7 So [or For] there are three witnesses[a] [who testify/bear witness]: 8 the Spirit, the water, and the blood; and these three witnesses agree [Lare one]. 9 We believe people when they say something is true. But what God says is more important [LIf we accept the witness/testimony of people, the witness/testimony of God is better], and he has told us the truth about his own Son [Lbecause this is the witness/testimony God has given about his Son]. 10 Anyone who believes in the Son of God has the truth that God told us [or has the internal testimony of the Holy Spirit; or has the testimony of the eyewitnesses (see 1:14); Lhas the witness/testimony in himself]. Anyone who does not believe makes God a liar [1:10], because that person does not believe what God told us [Lthe witness/testimony that God witnessed/testified to] about his Son. 11 This is what God told us [Lthe witness/testimony]: God has given us eternal life, and this life is in his Son. 12 Whoever has the Son has life, but whoever does not have the Son of God does not have life. 13 I write this letter [LI have written these things] to you who believe in the [Lname of the] Son of God so you will know you have eternal life. 14 And this is the boldness [confidence] we have in Gods presence [Lbefore God; 3:21]: that if we ask God for anything that agrees with what he wants [Laccording to his will], he hears us. 15 [LAnd] If we know he hears us every time we ask him [in whatever we ask], we know we have what we ask from him [3:2122; Mark 11:24]. 16 If anyone sees a brother or sister [Cfellow believer] sinning (sin that does not lead to eternal death [Ldeath]), that person should pray [ask; intercede], and God will give the sinner life. I am talking about people whose sin does not lead to eternal death [Ldeath]. There is sin [or a sin] that leads to [eternal] death [Cprobably referring to the false teachers, their rejection of the Spirits work having put them beyond repentance; compare Mark 3:29]. I do not mean that a person should pray [ask; intercede] about that sin. 17 Doing wrong is always sin [LAll unrighteousness is sin], but there is sin that does not lead to eternal death [Ldeath]. 18 We know that those who are Gods children [Lare born of/begotten by God] do not continue to sin [Lsin; 3:6, 9]. The Son of God [Lthe one born of/begotten by God; CJesus] keeps them safe [protects them], and the Evil One [Cthe Devil] cannot touch [harm] them. 19 We know that we belong to God [or are children of God; Lare of God], but the Evil One controls the whole world. 20 We also know that the Son of God has come and has given us understanding so that we can know the True One. And our lives [Lwe] are in the True One and in his Son, Jesus Christ. He is the true God and the eternal life. 21 So, dear children [2:1], keep yourselves away [guard yourselves] from false gods [Lidols; Ceither literal idols or false ideas about God]. "
