Version,ID,Book,Chapter,Chapter Title,Content
New Living Translation,NLT,1 John,5,Faith in the Son of God,"Everyone who believes that Jesus is the Christ[a] has become a child of God. And everyone who loves the Father loves his children, too. 2 We know we love Gods children if we love God and obey his commandments. 3 Loving God means keeping his commandments, and his commandments are not burdensome. 4 For every child of God defeats this evil world, and we achieve this victory through our faith. 5 And who can win this battle against the world? Only those who believe that Jesus is the Son of God. 6 And Jesus Christ was revealed as Gods Son by his baptism in water and by shedding his blood on the cross[b]not by water only, but by water and blood. And the Spirit, who is truth, confirms it with his testimony. 7 So we have these three witnesses[c] 8 the Spirit, the water, and the bloodand all three agree. 9 Since we believe human testimony, surely we can believe the greater testimony that comes from God. And God has testified about his Son. 10 All who believe in the Son of God know in their hearts that this testimony is true. Those who dont believe this are actually calling God a liar because they dont believe what God has testified about his Son. 11 And this is what God has testified: He has given us eternal life, and this life is in his Son. 12 Whoever has the Son has life; whoever does not have Gods Son does not have life. 13 I have written this to you who believe in the name of the Son of God, so that you may know you have eternal life. 14 And we are confident that he hears us whenever we ask for anything that pleases him. 15 And since we know he hears us when we make our requests, we also know that he will give us what we ask for. 16 If you see a fellow believer[d] sinning in a way that does not lead to death, you should pray, and God will give that person life. But there is a sin that leads to death, and I am not saying you should pray for those who commit it. 17 All wicked actions are sin, but not every sin leads to death. 18 We know that Gods children do not make a practice of sinning, for Gods Son holds them securely, and the evil one cannot touch them. 19 We know that we are children of God and that the world around us is under the control of the evil one. 20 And we know that the Son of God has come, and he has given us understanding so that we can know the true God.[e] And now we live in fellowship with the true God because we live in fellowship with his Son, Jesus Christ. He is the only true God, and he is eternal life. 21 Dear children, keep away from anything that might take Gods place in your hearts.[f] "
New Life Version,NLV,1 John,3,We Are Gods Children,"See what great love the Father has for us that He would call us His children. And that is what we are. For this reason the people of the world do not know who we are because they did not know Him. 2 Dear friends, we are Gods children now. But it has not yet been shown to us what we are going to be. We know that when He comes again, we will be like Him because we will see Him as He is. 3 The person who is looking for this to happen will keep himself pure because Christ is pure. 4 The person who keeps on sinning is guilty of not obeying the Law of God. For sin is breaking the Law of God. 5 You know that Christ came to take away our sins. There is no sin in Him. 6 The person who lives by the help of Christ does not keep on sinning. The person who keeps on sinning has not seen Him or has not known Him. 7 My children, let no one lead you in the wrong way. The man who does what is right, is right with God in the same way as Christ is right with God. 8 The person who keeps on sinning belongs to the devil. The devil has sinned from the beginning. But the Son of God came to destroy the works of the devil. 9 No person who has become a child of God keeps on sinning. This is because the Holy Spirit is in him. He cannot keep on sinning because God is his Father. 10 This is the way you can know who are the children of God and who are the children of the devil. The person who does not keep on doing what is right and does not love his brother does not belong to God. 11 This is what you have heard from the beginning, that we should love each other. 12 Do not be like Cain. He was a child of the devil and killed his brother. Why did he kill him? It was because he did what was sinful and his brother did what was right. 13 Do not be surprised if the world hates you, Christian brothers. 14 We know we have passed from death into life. We know this because we love the Christians. The person who does not love has not passed from death into life. 15 A man who hates his brother is a killer in his heart. You know that life which lasts forever is not in one who kills. 16 We know what love is because Christ gave His life for us. We should give our lives for our brothers. 17 What if a person has enough money to live on and sees his brother in need of food and clothing? If he does not help him, how can the love of God be in him? 18 My children, let us not love with words or in talk only. Let us love by what we do and in truth. 19 This is how we know we are Christians. It will give our heart comfort for sure when we stand before Him. 20 Our heart may say that we have done wrong. But remember, God is greater than our heart. He knows everything. 21 Dear friends, if our heart does not say that we are wrong, we will have no fear as we stand before Him. 22 We will receive from Him whatever we ask if we obey Him and do what He wants. 23 This is what He said we must do: Put your trust in the name of His Son, Jesus Christ, and love each other. Christ told us to do this. 24 The person who obeys Christ lives by the help of God and God lives in him. We know He lives in us by the Holy Spirit He has given us. "
New Living Translation,NLT,1 John,1,Introduction,"We proclaim to you the one who existed from the beginning,[a] whom we have heard and seen. We saw him with our own eyes and touched him with our own hands. He is the Word of life. 2 This one who is life itself was revealed to us, and we have seen him. And now we testify and proclaim to you that he is the one who is eternal life. He was with the Father, and then he was revealed to us. 3 We proclaim to you what we ourselves have actually seen and heard so that you may have fellowship with us. And our fellowship is with the Father and with his Son, Jesus Christ. 4 We are writing these things so that you may fully share our joy.[b] 5 This is the message we heard from Jesus[c] and now declare to you: God is light, and there is no darkness in him at all. 6 So we are lying if we say we have fellowship with God but go on living in spiritual darkness; we are not practicing the truth. 7 But if we are living in the light, as God is in the light, then we have fellowship with each other, and the blood of Jesus, his Son, cleanses us from all sin. 8 If we claim we have no sin, we are only fooling ourselves and not living in the truth. 9 But if we confess our sins to him, he is faithful and just to forgive us our sins and to cleanse us from all wickedness. 10 If we claim we have not sinned, we are calling God a liar and showing that his word has no place in our hearts. "
"New Revised Standard Version, Anglicised",NRSVA,1 John,1,The Word of Life,"We declare to you what was from the beginning, what we have heard, what we have seen with our eyes, what we have looked at and touched with our hands, concerning the word of life 2 this life was revealed, and we have seen it and testify to it, and declare to you the eternal life that was with the Father and was revealed to us 3 we declare to you what we have seen and heard so that you also may have fellowship with us; and truly our fellowship is with the Father and with his Son Jesus Christ. 4 We are writing these things so that our[a] joy may be complete. 5 This is the message we have heard from him and proclaim to you, that God is light and in him there is no darkness at all. 6 If we say that we have fellowship with him while we are walking in darkness, we lie and do not do what is true; 7 but if we walk in the light as he himself is in the light, we have fellowship with one another, and the blood of Jesus his Son cleanses us from all sin. 8 If we say that we have no sin, we deceive ourselves, and the truth is not in us. 9 If we confess our sins, he who is faithful and just will forgive us our sins and cleanse us from all unrighteousness. 10 If we say that we have not sinned, we make him a liar, and his word is not in us. "
New Matthew Bible,NMB,1 John,4,,"Ye beloveds, believe not every spirit, but test the spirits, whether they are of God or not. For many false prophets have gone out into the world. 2 By this you may know the spirit that is of God: every spirit that confesses that Jesus Christ has come in the flesh, is of God. 3 And every spirit which does not confess that Jesus Christ has come in the flesh, is not of God; and this is the spirit of Antichrist, of whom you have heard that he would come. And even now already he is in the world. 4 Little children, you are of God, and have overcome them. For greater is he that is in you than he that is in the world. 5 They are of the world, and therefore what they say is of the world, and the world hears them. 6 We are of God. He who knows God, hears us. He who is not of God, does not hear us. By this we know the spirit of truth and the spirit of error. 7 Beloveds, let us love one another. For love comes of God. And every one who loves is born of God and knows God. 8 He who does not love, does not know God. For God is love. 9 In this did the love of God for us appear, that God sent his only begotten Son into the world so that we may live through him. 10 Herein is love  not that we loved God, but that he loved us, and sent his Son to be the propitiation for our sins. 11 Beloveds, if God so loved us, we ought also to love one another. 12 No man has seen God at any time. If we love one another, God dwells in us, and his love is perfected in us. 13 By this we know that we dwell in him, and he in us  because he has given us of his Spirit. 14 And we have seen and do testify that the Father sent the Son, who is the Saviour of the world. 15 Whoever confesses that Jesus is the Son of God, in him dwells God, and he in God. 16 And we have known and believed the love that God has to us. God is love, and he who dwells in love dwells in God, and God in him. 17 In this is the love made perfect in us, so that we may have trust in the day of judgment. For as he is, even so are we in this world. 18 There is no fear in love, but perfect love casts out all fear. For fear has painfulness. He who fears is not perfect in love. 19 We love him because he first loved us. 20 If a person says, I love God, and yet hates his brother, he is a liar. For how can he who does not love his brother whom he has seen, love God whom he has not seen? 21 And this commandment we have from him: that he who loves God, should love his brother also. "
New Matthew Bible,NMB,1 John,2,,"My little children, these things I write to you so that you do not sin. Yet if anyone sins, we have an advocate with the Father: Jesus Christ the Righteous, 2 and he is the propitiation for our sins; and not for our sins only, but also for the sins of all the world. 3 And hereby are we sure that we know him: if we keep his commandments. 4 He who says, I know him, and does not keep his commandments, is a liar, and the truth is not in him. 5 Whoever keeps his word, in him is the love of God perfected in deed. And thereby we know that we are in him. 6 He who says he abides in him ought to walk even as he walked. 7 Brethren, I write no new commandment to you, but that old commandment that you heard from the beginning. The old commandment is the word that you heard from the beginning. 8 Again, a new commandment I write to you, a thing that is true in him and also in you. For the darkness is past and the true light now shines. 9 He who says that he is in the light and yet hates his brother, is in darkness even until this time. 10 He who loves his brother abides in the light, and there is no occasion of evil in him. 11 He who hates his brother is in darkness, and walks in darkness, and does not know where he goes because the darkness has blinded his eyes. 12 Babes, I write to you because your sins are forgiven you for his names sake. 13 I write to you fathers because you know him who was from the beginning. I write to you young men because you have overcome the wicked one. I write to you little children because you know the Father. 14 I write to you fathers because you know him who was from the beginning. I write to you young men because you are strong, and the word of God abides in you, and you have overcome that wicked one. 15 See that you love not the world, neither the things that are in the world. If anyone loves the world, the love of the Father is not in him. 16 For all that is in the world (as the lust of the flesh, the lust of the eyes, and the pride of goods) is not of the Father, but of the world. 17 And the world is vanishing away, and the desires of it. But he who fulfils the will of God endures forever. 18 Little children, it is the last time. And as you have heard that Antichrist shall come, even now there are many Antichrists come already. By this we know that it is the last time. 19 They went out from us, but they were not of us. For if they had been of us, they would no doubt have continued with us. But this happened so that it might appear that they were not of us. 20 And you have an anointing of the Holy Spirit, and you know all things. 21 I did not write to you as though you did not know the truth, but as knowing it, and as knowing also that no lie comes of truth. 22 Who is a liar, but he who denies that Jesus is Christ? He is the Antichrist, who denies the Father and the Son. 23 Whoever denies the Son, the same does not have the Father. 24 Let therefore abide in you that which you heard from the beginning. If that which you heard from the beginning remains in you, you also will continue in the Son and in the Father. 25 And the promise that he has promised us is eternal life. 26 This I have written to you concerning those who deceive you. 27 And the anointing that you have received from him dwells in you, and you need not that any man teach you  but as the anointing teaches you all things, and is true, and is no lie, and as it taught you, even so abide therein. 28 And now babes, abide in him, so that when he appears we may be bold, and not be made ashamed before him at his coming. 29 If you know that he is righteous, know also that he who follows righteousness is born of him. "
New Life Version,NLV,1 John,2,Christ Is Our Helper,"My dear children, I am writing this to you so you will not sin. But if anyone does sin, there is One Who will go between him and the Father. He is Jesus Christ, the One Who is right with God. 2 He paid for our sins with His own blood. He did not pay for ours only, but for the sins of the whole world. 3 We can be sure that we know Him if we obey His teaching. 4 Anyone who says, I know Him, but does not obey His teaching is a liar. There is no truth in him. 5 But whoever obeys His Word has the love of God made perfect in him. This is the way to know if you belong to Christ. 6 The one who says he belongs to Christ should live the same kind of life Christ lived. 7 Dear friends, I am not writing a new Law for you to obey. It is an old Law you have had from the beginning. The old Law is the Word that you have heard. 8 And yet it is a new Law that I am writing to you. It is truth. It was seen in Christ and it is seen in you also. The darkness is passing away and the true Light shines instead. 9 Whoever says he is in the light but hates his brother is still in darkness. 10 But whoever loves his brother is in the light. And there will be no reason to sin because of him. 11 Whoever hates his brother is not in the light but lives in darkness. He does not know where he is going because the darkness has blinded his eyes. 12 I am writing to you, my children, for your sins have been forgiven because of Christs name. 13 I am writing to you, fathers, because you know Him Who has been from the beginning. I am writing to you, young men, because you have power over the devil. I have written to you, young boys and girls, because you have learned to know the Father. 14 I have written to you, fathers, because you know Him Who has been from the beginning. I have written to you, young men, because you are strong. You have kept Gods Word in your hearts. You have power over the devil. 15 Do not love the world or anything in the world. If anyone loves the world, the Fathers love is not in him. 16 For everything that is in the world does not come from the Father. The desires of our flesh and the things our eyes see and want and the pride of this life come from the world. 17 The world and all its desires will pass away. But the man who obeys God and does what He wants done will live forever. 18 My children, we are near the end of the world. You have heard that the false-christ is coming. Many false-christs have already come. This is how we know the end of the world is near. 19 These left us. But they never belonged to us. If they had been a part of us, they would have stayed with us. Because they left, it is known they did not belong to us. 20 The Holy Spirit has been given to you and you all know the truth. 21 I have not written to you because you do not know the truth. I have written because you do know the truth and you know that no lie comes from the truth. 22 Who is a liar? He is a person who says that Jesus is not the Christ. The false-christ will have nothing to do with the Father and the Son and he will turn away from Them. 23 A person who will have nothing to do with the Son and turns against Him does not have the Father. The one who says he knows the Son has the Father also. 24 Keep in your heart what you have heard from the beginning. Then you will belong to the Son and to the Father if what you have heard from the beginning is in you. 25 And He has promised us life that lasts forever! 26 I have written to you about those who are trying to lead you in the wrong way. 27 Christ gave you the Holy Spirit and He lives in you. You do not need anyone to teach you. The Holy Spirit is able to teach you all things. What He teaches you is truth and not a lie. Live by the help of Christ as the Holy Spirit has taught you. 28 And now, my children, live by the help of Him. Then when He comes again, we will be glad to see Him and not be ashamed. 29 You know that Christ is right with God. Then you should know that everyone who is right with God is a child of His. "
New Matthew Bible,NMB,1 John,5,,"Whoever believes that Jesus is the Christ, is born of God. And everyone who loves him who begat, loves also the child who was born of him. 2 In this we know that we love the children of God: when we love God and keep his commandments. 3 This is the love of God, that we keep his commandments. And his commandments are not grievous. 4 For all that is born of God overcomes the world. And this is the victory that overcomes the world, even our faith. 5 Who is it that overcomes the world, but he who believes that Jesus is the Son of God? 6 This Jesus Christ is he who came by water and blood  not by water only, but by water and blood. And it is the Spirit that bears witness, because the Spirit is truth. 7 (For there are three that bear witness in heaven: the Father, the word, and the Holy Spirit; and these three are one.) 8 And there are three which bear witness (in earth): the Spirit, and the water, and the blood; and these three are one. 9 If we receive the witness of men, the witness of God is greater. For this is the witness of God, which he testified of his Son. 10 He who believes on the Son of God has the witness in himself. He who does not believe God has made him a liar, because he has not believed the testimony that God gave of his Son. 11 And this is that testimony: that God has given to us eternal life, and this life is in his Son. 12 He who has the Son has life, and he who does not have the Son of God, does not have life. 13 These things I have written to you who believe on the name of the Son of God, so that you may know that you have eternal life, and so that you may believe on the name of the Son of God. 14 And this is the trust that we have in him: that if we ask anything according to his will, he hears us. 15 And if we know that he hears us, whatsoever we ask, we know that we will have the petitions that we ask of him. 16 If anyone sees his brother sin a sin that is not unto death, let him ask, and he will give him life for those who do not sin unto death. There is a sin unto death, for which I do not say that a person should pray. 17 All unrighteousness is sin, but there is sin not unto death. 18 We know that whoever is born of God does not sin, but he who is begotten of God keeps himself, and that wicked one does not touch him. 19 We know that we are of God, and that the world is altogether set on wickedness. 20 We know that the Son of God has come, and has given us a mind to know him who is true. And we are in him who is true through his Son Jesus Christ. This same is very God and eternal life. 21 Babes, keep yourselvesfrom idols.Amen. "
"New Revised Standard Version, Anglicised",NRSVA,1 John,2,Christ Our Advocate,"My little children, I am writing these things to you so that you may not sin. But if anyone does sin, we have an advocate with the Father, Jesus Christ the righteous; 2 and he is the atoning sacrifice for our sins, and not for ours only but also for the sins of the whole world. 3 Now by this we may be sure that we know him, if we obey his commandments. 4 Whoever says, I have come to know him, but does not obey his commandments, is a liar, and in such a person the truth does not exist; 5 but whoever obeys his word, truly in this person the love of God has reached perfection. By this we may be sure that we are in him: 6 whoever says, I abide in him, ought to walk just as he walked. 7 Beloved, I am writing you no new commandment, but an old commandment that you have had from the beginning; the old commandment is the word that you have heard. 8 Yet I am writing you a new commandment that is true in him and in you, because[a] the darkness is passing away and the true light is already shining. 9 Whoever says, I am in the light, while hating a brother or sister,[b] is still in the darkness. 10 Whoever loves a brother or sister[c] lives in the light, and in such a person[d] there is no cause for stumbling. 11 But whoever hates another believer[e] is in the darkness, walks in the darkness, and does not know the way to go, because the darkness has brought on blindness. 12 I am writing to you, little children, because your sins are forgiven on account of his name. 13 I am writing to you, fathers, because you know him who is from the beginning. I am writing to you, young people, because you have conquered the evil one. 14 I write to you, children, because you know the Father. I write to you, fathers, because you know him who is from the beginning. I write to you, young people, because you are strong and the word of God abides in you, and you have overcome the evil one. 15 Do not love the world or the things in the world. The love of the Father is not in those who love the world; 16 for all that is in the worldthe desire of the flesh, the desire of the eyes, the pride in richescomes not from the Father but from the world. 17 And the world and its desire[f] are passing away, but those who do the will of God live for ever. 18 Children, it is the last hour! As you have heard that antichrist is coming, so now many antichrists have come. From this we know that it is the last hour. 19 They went out from us, but they did not belong to us; for if they had belonged to us, they would have remained with us. But by going out they made it plain that none of them belongs to us. 20 But you have been anointed by the Holy One, and all of you have knowledge.[g] 21 I write to you, not because you do not know the truth, but because you know it, and you know that no lie comes from the truth. 22 Who is the liar but the one who denies that Jesus is the Christ?[h] This is the antichrist, the one who denies the Father and the Son. 23 No one who denies the Son has the Father; everyone who confesses the Son has the Father also. 24 Let what you heard from the beginning abide in you. If what you heard from the beginning abides in you, then you will abide in the Son and in the Father. 25 And this is what he has promised us,[i] eternal life. 26 I write these things to you concerning those who would deceive you. 27 As for you, the anointing that you received from him abides in you, and so you do not need anyone to teach you. But as his anointing teaches you about all things, and is true and is not a lie, and just as it has taught you, abide in him.[j] 28 And now, little children, abide in him, so that when he is revealed we may have confidence and not be put to shame before him at his coming. 29 If you know that he is righteous, you may be sure that everyone who does right has been born of him. "
