Version,ID,Book,Chapter,Chapter Title,Content
Living Bible,TLB,1 John,2,,"My little children, I am telling you this so that you will stay away from sin. But if you sin, there is someone to plead for you before the Father. His name is Jesus Christ, the one who is all that is good and who pleases God completely. 2 He is the one who took Gods wrath against our sins upon himself and brought us into fellowship with God; and he is the forgiveness for our sins,[a] and not only ours but all the worlds. 3 And how can we be sure that we belong to him? By looking within ourselves: are we really trying to do what he wants us to? 4 Someone may say, I am a Christian; I am on my way to heaven; I belong to Christ. But if he doesnt do what Christ tells him to, he is a liar. 5 But those who do what Christ tells them to will learn to love God more and more. That is the way to know whether or not you are a Christian. 6 Anyone who says he is a Christian should live as Christ did. 7 Dear brothers, I am not writing out a new rule for you to obey, for it is an old one you have always had, right from the start. You have heard it all before. 8 Yet it is always new, and works for you just as it did for Christ; and as we obey this commandment, to love one another, the darkness in our lives disappears and the new light of life in Christ shines in. 9 Anyone who says he is walking in the light of Christ but dislikes his fellow man is still in darkness. 10 But whoever loves his fellow man is walking in the light and can see his way without stumbling around in darkness and sin. 11 For he who dislikes his brother is wandering in spiritual darkness and doesnt know where he is going, for the darkness has made him blind so that he cannot see the way. 12 I am writing these things to all of you, my little children, because your sins have been forgiven in the name of Jesus our Savior. 13 I am saying these things to you older men because you really know Christ, the one who has been alive from the beginning. And you young men, I am talking to you because you have won your battle with Satan. And I am writing to you younger boys and girls because you, too, have learned to know God our Father. 14 And so I say to you fathers who know the eternal God, and to you young men who are strong with Gods Word in your hearts, and have won your struggle against Satan: 15 Stop loving this evil world and all that it offers you, for when you love these things you show that you do not really love God; 16 for all these worldly things, these evil desiresthe craze for sex, the ambition to buy everything that appeals to you, and the pride that comes from wealth and importancethese are not from God. They are from this evil world itself. 17 And this world is fading away, and these evil, forbidden things will go with it, but whoever keeps doing the will of God will live forever. 18 Dear children, this worlds last hour has come. You have heard about the Antichrist who is comingthe one who is against Christand already many such persons have appeared. This makes us all the more certain that the end of the world is near. 19 These against-Christ people used to be members of our churches, but they never really belonged with us or else they would have stayed. When they left us it proved that they were not of us at all. 20 But you are not like that, for the Holy Spirit has come upon you, and you know the truth. 21 So I am not writing to you as to those who need to know the truth, but I warn you as those who can discern the difference between true and false. 22 And who is the greatest liar? The one who says that Jesus is not Christ. Such a person is antichrist, for he does not believe in God the Father and in his Son. 23 For a person who doesnt believe in Christ, Gods Son, cant have God the Father either. But he who has Christ, Gods Son, has God the Father also. 24 So keep on believing what you have been taught from the beginning. If you do, you will always be in close fellowship with both God the Father and his Son. 25 And he himself has promised us this: eternal life. 26 These remarks of mine about the Antichrist are pointed at those who would dearly love to blindfold you and lead you astray. 27 But you have received the Holy Spirit, and he lives within you, in your hearts, so that you dont need anyone to teach you what is right. For he teaches you all things, and he is the Truth, and no liar; and so, just as he has said, you must live in Christ, never to depart from him. 28 And now, my little children, stay in happy fellowship with the Lord so that when he comes you will be sure that all is well and will not have to be ashamed and shrink back from meeting him. 29 Since we know that God is always good and does only right, we may rightly assume that all those who do right are his children. "
Legacy Standard Bible,LSB,1 John,3,"Children of God, Love One Another","See [a]how great a love the Father has given to us, that we would be called (B)children of God; and we are. For this reason the world does not know us, because (C)it did not know Him. 2 Beloved, now we are (E)children of God, and (F)it has not been manifested as yet what we will be. We know that when He (G)is manifested, we will be (H)like Him, because we will (I)see Him just as He is. 3 And everyone who has this hope fixed on Him (K)purifies himself, just as He is pure. 4 Everyone who does sin also does lawlessness; and sin is lawlessness. 5 And you know that He was manifested in order to (N)take away sins, and (O)in Him there is no sin. 6 No one who abides in Him sins; no one who sins has seen Him or [b](Q)has come to know Him. 7 Little children, let no one (S)deceive you. (T)The one who does righteousness is righteous, just as He is righteous. 8 The one who does sin is of the devil, because the devil sins from the beginning. (V)The Son of God (W)was manifested for this purpose, (X)to destroy the works of the devil. 9 Everyone who has been [c]born of God (Z)does not sin, because His seed abides in him; and he cannot sin, because he has been [d]born of God. 10 By this the children of God and the (AB)children of the devil are manifested: everyone who does not do righteousness is not of God, as well as the one who (AC)does not love his (AD)brother. 11 For this is the message (AF)which you have heard from the beginning, (AG)that we should love one another; 12 not as Cain, who was of (AI)the evil one and slew his brother. And for what reason did he slay him? Because (AJ)his deeds were evil, and his brothers were righteous. 13 Do not marvel, brothers, if the world hates you. 14 We know that we have passed out of death into life, (AM)because we love the brothers. The one who does not love abides in death. 15 Everyone who hates his brother is a murderer, and you know that (AO)no murderer has eternal life abiding in him. 16 By this we have known love, that He laid down His life for us; and (AQ)we ought to lay down our lives for the (AR)brothers. 17 But whoever has the worlds goods, and sees his brother in need and (AT)closes his [e]heart [f]against him, (AU)how does the love of God abide in him? 18 Little children, let us not love with word or with tongue, but in deed and (AW)truth. 19 And by this we will know that we are of the truth, and will [g]assure our heart before Him 20 [h]in whatever our heart condemns us; for God is greater than our heart and knows all things. 21 Beloved, if our heart does not condemn us, we have (AZ)confidence [i]before God; 22 and whatever we ask we receive from Him, because we (BB)keep His commandments and do (BC)the things that are pleasing in His sight. 23 And this is His commandment, that we [j]believe in (BE)the name of His Son Jesus Christ, and love one another, just as (BF)He gave a commandment to us. 24 And the one who keeps His commandments (BH)abides in Him, and He in him. (BI)We know by this that (BJ)He abides in us, by the Spirit whom He gave us. "
Lexham English Bible,LEB,1 John,2,Keeping the New Commandment,"My little children, I am writing these things to you in order that you may not sin. And if anyone sins, we have an advocate with the Father, Jesus Christ the righteous one, 2 and he[a] is the propitiation[b] for our sins, and not for ours only, but also for the sins of the whole world. 3 And by this we know that we have come to know him, if we keep his commandments. 4 The one who says I have come to know him, and does not keep his commandments is a liar, and the truth is not in this person. 5 But whoever keeps his word, truly in this person the love of God has been perfected. By this we know that we are in him. 6 The one who says that he resides in him ought also to walk[c] just as that one walked. 7 Dear friends, I am not writing a new commandment to you, but an old commandment which you have had from the beginning. The old commandment is the message which you have heard. 8 Again, I am writing a new commandment to you, which is true in him and in you, because[d] the darkness is passing away and the true light already is shining. 9 The one who says he is in the light and hates his brother is in the darkness until now. 10 The one who loves his brother resides in the light, and there is no cause for stumbling in him. 11 But the one who hates his brother is in the darkness, and walks in the darkness, and does not know where he is going, because the darkness has blinded his eyes. 12 I am writing to you, little children, because[e] your sins have been forgiven you on account of his name. 13 I am writing to you, fathers, because[f] you have known the One who is from the beginning. I am writing to you, young men, because[g] you have conquered the evil one. 14 I have written to you, children, because[h] you have known the Father. I have written to you, fathers, because[i] you have known the One who is from the beginning. I have written to you, young men, because[j] you are strong, and the word of God resides in you, and you have conquered the evil one. 15 Do not love the world or the things in the world. If anyone loves the world, the love of the Father is not in him, 16 because everything that is in the worldthe desire of the flesh and the desire of the eyes and the arrogance of material possessionsis not from the Father, but is from the world. 17 And the world is passing away, and its desire,[k] but the one who does the will of God remains forever[l]. 18 Children, it is the last hour, and just as you have heard that antichrist is coming, even now many antichrists have arisen, by which we know that it is the last hour. 19 They went out from us, but they were not of us; for if they had been of us, they would have remained with us. But they went out[m], in order that it might be shown that all of them are not of us. 20 And you have an anointing from the Holy One, and you all know. 21 I have not written to you because[n] you do not know the truth, but because[o] you do know it, and because[p] every lie is not of the truth. 22 Who is the liar except the one who denies that Jesus is the Christ? This person is the antichrist, the one who denies the Father and the Son. 23 Everyone who denies the Son does not have the Father either; the one who confesses the Son has the Father also. 24 As for you, what you have heard from the beginning must remain in you. If what you have heard from the beginning remains in you, you also will remain in the Son and in the Father. 25 And this is the promise which he himself promised us: eternal life. 26 These things I have written to you concerning the ones who are trying to deceive you. 27 And as for you, the anointing which you received from him remains in you, and you do not have need that anyone teach you. But as his anointing teaches you about all things, and is true and is not a lie, and just as it has taught you, you reside[q] in him. 28 And now, little children, remain in him, so that whenever he is revealed we may have confidence and not be put to shame before him at his coming. 29 If you know that he is righteous, you know that everyone[r] who practices righteousness has been fathered by him. "
Lexham English Bible,LEB,1 John,1,Prologue,"What was from the beginning, what we have heard, what we have seen with our eyes, what we have looked at and our hands have touched, concerning the word of life 2 and the life was revealed, and we have seen and testify and announce to you the eternal life which was with the Father and was revealed to us 3 what we have seen and heard, we announce to you also, in order that you also may have fellowship with us, and indeed our fellowship is with the Father and with his Son Jesus Christ. 4 And these things we write, in order that our joy may be complete. 5 And this is the message which we have heard from him and announce to you, that God is light and there is no darkness in him at all. 6 If we say that we have fellowship with him and walk in the darkness, we lie and do not practice the truth.[a] 7 But if we walk in the light as he is in the light, we have fellowship with one another, and the blood of Jesus his Son cleanses us from all sin. 8 If we say that we do not have sin, we deceive ourselves and the truth is not in us. 9 If we confess our sins, he is faithful and just, so that he will forgive us our[b] sins and will cleanse us from all unrighteousness. 10 If we say that we have not sinned, we make him a liar, and his word is not in us. "
The Message,MSG,1 John,2,The Only Way to Know Were in Him,"1-2 I write this, dear children, to guide you out of sin. But if anyone does sin, we have a Priest-Friend in the presence of the Father: Jesus Christ, righteous Jesus. When he served as a sacrifice for our sins, he solved the sin problem for goodnot only ours, but the whole worlds. 2-3 Heres how we can be sure that we know God in the right way: Keep his commandments. 4-6 If someone claims, I know him well! but doesnt keep his commandments, hes obviously a liar. His life doesnt match his words. But the one who keeps Gods word is the person in whom we see Gods mature love. This is the only way to be sure were in God. Anyone who claims to be intimate with God ought to live the same kind of life Jesus lived. 7-8 My dear friends, Im not writing anything new here. This is the oldest commandment in the book, and youve known it from day one. Its always been implicit in the Message youve heard. On the other hand, perhaps it is new, freshly minted as it is in both Christ and youthe darkness fading away and the True Light already blazing! 9-11 Anyone who claims to live in Gods light and hates a brother or sister is still in the dark. Its the person who loves brother and sister who dwells in Gods light and doesnt block the light from others. But whoever hates is still in the dark, stumbles around in the dark, doesnt know which end is up, blinded by the darkness. 12-13 I remind you, my dear children: Your sins are forgiven in Jesus name. You veterans were in on the ground floor, and know the One who started all this; you newcomers have won a big victory over the Evil One. 13-14 And a second reminder, dear children: You know the Father from personal experience. You veterans know the One who started it all; and you newcomerssuch vitality and strength! Gods word is so steady in you. Your fellowship with God enables you to gain a victory over the Evil One. 15-17 Dont love the worlds ways. Dont love the worlds goods. Love of the world squeezes out love for the Father. Practically everything that goes on in the worldwanting your own way, wanting everything for yourself, wanting to appear importanthas nothing to do with the Father. It just isolates you from him. The world and all its wanting, wanting, wanting is on the way outbut whoever does what God wants is set for eternity. 18 Children, time is just about up. You heard that Antichrist is coming. Well, theyre all over the place, antichrists everywhere you look. Thats how we know that were close to the end. 19 They left us, but they were never really with us. If they had been, they would have stuck it out with us, loyal to the end. In leaving, they showed their true colors, showed they never did belong. 20-21 But you belong. The Holy One anointed you, and you all know it. I havent been writing this to tell you something you dont know, but to confirm the truth you do know, and to remind you that the truth doesnt breed lies. 22-23 So who is lying here? Its the person who denies that Jesus is the Divine Christ, thats who. This is what makes an antichrist: denying the Father, denying the Son. No one who denies the Son has any part with the Father, but affirming the Son is an embrace of the Father as well. 24-25 Stay with what you heard from the beginning, the original message. Let it sink into your life. If what you heard from the beginning lives deeply in you, you will live deeply in both Son and Father. This is exactly what Christ promised: eternal life, real life! 26-27 Ive written to warn you about those who are trying to deceive you. But theyre no match for what is embedded deeply within youChrists anointing, no less! You dont need any of their so-called teaching. Christs anointing teaches you the truth on everything you need to know about yourself and him, uncontaminated by a single lie. Live deeply in what you were taught. 28 And now, children, stay with Christ. Live deeply in Christ. Then well be ready for him when he appears, ready to receive him with open arms, with no cause for red-faced guilt or lame excuses when he arrives. 29 Once youre convinced that he is right and righteous, youll recognize that all who practice righteousness are Gods true children. "
The Message,MSG,1 John,3,When We Practice Real Love,"What marvelous love the Father has extended to us! Just look at itwere called children of God! Thats who we really are. But thats also why the world doesnt recognize us or take us seriously, because it has no idea who he is or what hes up to. 2-3 But friends, thats exactly who we are: children of God. And thats only the beginning. Who knows how well end up! What we know is that when Christ is openly revealed, well see himand in seeing him, become like him. All of us who look forward to his Coming stay ready, with the glistening purity of Jesus life as a model for our own. 4-6 All who indulge in a sinful life are dangerously lawless, for sin is a major disruption of Gods order. Surely you know that Christ showed up in order to get rid of sin. There is no sin in him, and sin is not part of his program. No one who lives deeply in Christ makes a practice of sin. None of those who do practice sin have taken a good look at Christ. Theyve got him all backward. 7-8 So, my dear children, dont let anyone divert you from the truth. Its the person who acts right who is right, just as we see it lived out in our righteous Messiah. Those who make a practice of sin are straight from the Devil, the pioneer in the practice of sin. The Son of God entered the scene to abolish the Devils ways. 9-10 People conceived and brought into life by God dont make a practice of sin. How could they? Gods seed is deep within them, making them who they are. Its not in the nature of the God-born to practice and parade sin. Heres how you tell the difference between Gods children and the Devils children: The one who wont practice righteous ways isnt from God, nor is the one who wont love brother or sister. A simple test. * * * 11 For this is the original message we heard: We should love each other. 12-13 We must not be like Cain, who joined the Evil One and then killed his brother. And why did he kill him? Because he was deep in the practice of evil, while the acts of his brother were righteous. So dont be surprised, friends, when the world hates you. This has been going on a long time. 14-15 The way we know weve been transferred from death to life is that we love our brothers and sisters. Anyone who doesnt love is as good as dead. Anyone who hates a brother or sister is a murderer, and you know very well that eternal life and murder dont go together. 16-17 This is how weve come to understand and experience love: Christ sacrificed his life for us. This is why we ought to live sacrificially for our fellow believers, and not just be out for ourselves. If you see some brother or sister in need and have the means to do something about it but turn a cold shoulder and do nothing, what happens to Gods love? It disappears. And you made it disappear. 18-20 My dear children, lets not just talk about love; lets practice real love. This is the only way well know were living truly, living in Gods reality. Its also the way to shut down debilitating self-criticism, even when there is something to it. For God is greater than our worried hearts and knows more about us than we do ourselves. 21-24 And friends, once thats taken care of and were no longer accusing or condemning ourselves, were bold and free before God! Were able to stretch our hands out and receive what we asked for because were doing what he said, doing what pleases him. Again, this is Gods command: to believe in his personally named Son, Jesus Christ. He told us to love each other, in line with the original command. As we keep his commands, we live deeply and surely in him, and he lives in us. And this is how we experience his deep and abiding presence in us: by the Spirit he gave us. "
Living Bible,TLB,1 John,5,,"If you believe that Jesus is the Christthat he is Gods Son and your Saviorthen you are a child of God. And all who love the Father love his children too. 2 So you can find out how much you love Gods childrenyour brothers and sisters in the Lordby how much you love and obey God. 3 Loving God means doing what he tells us to do, and really, that isnt hard at all; 4 for every child of God can obey him, defeating sin and evil pleasure by trusting Christ to help him. 5 But who could possibly fight and win this battle except by believing that Jesus is truly the Son of God? 6-8 And we know he is, because God said so with a voice from heaven when Jesus was baptized, and again as he was facing death[a]yes, not only at his baptism but also as he faced death. And the Holy Spirit, forever truthful, says it too. So we have these three witnesses: the voice of the Holy Spirit in our hearts, the voice from heaven at Christs baptism, and the voice before he died. And they all say the same thing: that Jesus Christ is the Son of God. 9 We believe men who witness in our courts, and so surely we can believe whatever God declares. And God declares that Jesus is his Son. 10 All who believe this know in their hearts that it is true. If anyone doesnt believe this, he is actually calling God a liar because he doesnt believe what God has said about his Son. 11 And what is it that God has said? That he has given us eternal life and that this life is in his Son. 12 So whoever has Gods Son has life; whoever does not have his Son, does not have life. 13 I have written this to you who believe in the Son of God so that you may know you have eternal life. 14 And we are sure of this, that he will listen to us whenever we ask him for anything in line with his will. 15 And if we really know he is listening when we talk to him and make our requests, then we can be sure that he will answer us. 16 If you see a Christian sinning in a way that does not end in death, you should ask God to forgive him, and God will give him life unless he has sinned that one fatal sin. But there is that one sin which ends in death, and if he has done that, there is no use praying for him. 17 Every wrong is a sin, of course. Im not talking about these ordinary sins; I am speaking of that one that ends in death.[b] 18 No one who has become part of Gods family makes a practice of sinning, for Christ, Gods Son, holds him securely, and the devil cannot get his hands on him. 19 We know that we are children of God and that all the rest of the world around us is under Satans power and control. 20 And we know that Christ, Gods Son, has come to help us understand and find the true God. And now we are in God because we are in Jesus Christ his Son, who is the only true God; and he is eternal Life. 21 Dear children, keep away from anything that might take Gods place in your hearts. Amen. Sincerely, John "
Modern English Version,MEV,1 John,1,The Word of Life,"That which was from the beginning, which we have heard, which we have seen with our eyes, which we have looked upon, and our hands have touched, concerning the Word of life 2 the life was revealed, and we have seen it and testify to it, and announce to you the eternal life, which was with the Father and was revealed to us 3 we declare to you that which we have seen and heard, that you also may have fellowship with us. And our fellowship is with the Father and with His Son Jesus Christ. 4 We are writing these things to you so that our joy may be complete. 5 This then is the message which we have heard from Him and declare to you: God is light, and in Him is no darkness at all. 6 If we say that we have fellowship with Him, yet walk in darkness, we lie and do not practice the truth. 7 But if we walk in the light as He is in the light, we have fellowship one with another, and the blood of Jesus Christ His Son cleanses us from all sin. 8 If we say that we have no sin, we deceive ourselves, and the truth is not in us. 9 If we confess our sins, He is faithful and just to forgive us our sins and cleanse us from all unrighteousness. 10 If we say that we have not sinned, we make Him a liar and His word is not in us. "
